{
  "profileId": "a1b2c3d4-0001-4000-8000-000000000001",
  "profileVersion": "1.0.0",
  "name": "RDX Schema Minimum",
  "description": "Requires only the fields that the RDX JSON Schema marks as required. All other fields are optional. Use this profile when you need a syntactically valid RDX document with no additional data completeness constraints beyond what the schema enforces.",
  "rdxSchemaVersion": "0.1.0",
  "created": "2026-05-05T00:00:00Z",
  "createdBy": "ASRG RDX Technical Committee",
  "defaultFieldRequirement": "optional",
  "fieldRequirements": {
    "schemaVersion": "required",
    "documentId": "required",
    "riskSet": "required",
    "riskSet.itemDefinition": "required",
    "riskSet.itemDefinition.id": "required",
    "riskSet.itemDefinition.title": "required",
    "riskSet.assets.*.id": "required",
    "riskSet.assets.*.title": "required",
    "riskSet.damageScenarios.*.id": "required",
    "riskSet.damageScenarios.*.title": "required",
    "riskSet.threatScenarios.*.id": "required",
    "riskSet.threatScenarios.*.title": "required",
    "riskSet.threatScenarios.*.targetedAssetIds": "required",
    "riskSet.attackSteps.*.id": "required",
    "riskSet.attackSteps.*.title": "required",
    "riskSet.attackPaths.*.id": "required",
    "riskSet.attackPaths.*.title": "required",
    "riskSet.attackPaths.*.threatScenarioId": "required",
    "riskSet.methods.*.id": "required",
    "riskSet.methods.*.name": "required",
    "riskSet.methods.*.version": "required",
    "riskSet.attackFeasibilityRatings.*.id": "required",
    "riskSet.attackFeasibilityRatings.*.methodId": "required",
    "riskSet.attackFeasibilityRatings.*.score": "required",
    "riskSet.impactRatings.*.id": "required",
    "riskSet.impactRatings.*.damageScenarioId": "required",
    "riskSet.impactRatings.*.methodId": "required",
    "riskSet.impactRatings.*.score": "required",
    "riskSet.riskValues.*.id": "required",
    "riskSet.riskValues.*.threatScenarioId": "required",
    "riskSet.riskValues.*.afrRef": "required",
    "riskSet.riskValues.*.impactRef": "required",
    "riskSet.riskValues.*.methodId": "required",
    "riskSet.riskValues.*.score": "required",
    "riskSet.controls.*.id": "required",
    "riskSet.controls.*.title": "required",
    "riskSet.riskTreatmentDecisions.*.id": "required",
    "riskSet.riskTreatmentDecisions.*.riskValueId": "required",
    "riskSet.riskTreatmentDecisions.*.decision": "required"
  },
  "integrity": {
    "alg": "SHA-256",
    "content": "b77238fd1dc255a049ffa9d6a75226010df9c9b575a27ba459ff0ea8f46206f5"
  }
}
